{
  "schema_version": "0.2",
  "identificatie": {
    "bag_vboid": "0037010000368601",
    "straat": "Essenhage",
    "huisnummer": "32",
    "postcode": "9501TP",
    "plaats": "Stadskanaal",
    "bouwjaar": 1979,
    "renovatiejaar": null,
    "renovatiejaar_toelichting": "",
    "woningtype": "Tussenwoning",
    "aantal_bouwlagen": 2
  },
  "adviseur": {
    "naam": "Renze Poortinga",
    "bedrijf": "Poortinga Energieadvies",
    "telefoon": "0616691927",
    "email": "info@poortinga-energieadvies.nl",
    "registratie": ""
  },
  "opname": {
    "opnamedatum": "2026-02-24",
    "rapportagedatum": "2026-03-10",
    "type_advies": "Basis",
    "qv10_gemeten": false,
    "qv10_waarde": null,
    "bewijslast": "Geen"
  },
  "geometrie": {
    "gebruiksoppervlakte_ag_m2": 57.7,
    "verwarmd_volume_m3": 198.59,
    "perimeter_m": 40.72,
    "vloeren": [
      {
        "naam": "Begane grond",
        "oppervlakte_m2": 56.31,
        "hoogte_m": 2.61
      }
    ]
  },
  "schil": [
    {
      "id": "gevel-voor",
      "type": "gevel",
      "subtype": "Spouwmuur",
      "begrenzing": "Buitenlucht",
      "orientatie": "Z",
      "oppervlakte_m2": 24.0,
      "isolatie_aanwezig": "Niet",
      "rc_huidig": 0.43,
      "u_huidig": null,
      "spouw_aanwezig": true,
      "isolatiedikte_mm": null,
      "glastype": "",
      "kozijnmateriaal": "",
      "rc_bron": "Forfaitair bouwjaar",
      "opmerkingen": ""
    },
    {
      "id": "gevel-achter",
      "type": "gevel",
      "subtype": "Spouwmuur",
      "begrenzing": "Buitenlucht",
      "orientatie": "N",
      "oppervlakte_m2": 24.0,
      "isolatie_aanwezig": "Niet",
      "rc_huidig": 0.43,
      "u_huidig": null,
      "spouw_aanwezig": true,
      "isolatiedikte_mm": null,
      "glastype": "",
      "kozijnmateriaal": "",
      "rc_bron": "Forfaitair bouwjaar",
      "opmerkingen": ""
    },
    {
      "id": "vloer-bg",
      "type": "vloer",
      "subtype": "Begane grondvloer",
      "begrenzing": "Grond",
      "orientatie": "horizontaal",
      "oppervlakte_m2": 56.31,
      "isolatie_aanwezig": "Niet",
      "rc_huidig": 0.15,
      "u_huidig": null,
      "spouw_aanwezig": null,
      "isolatiedikte_mm": null,
      "glastype": "",
      "kozijnmateriaal": "",
      "rc_bron": "Forfaitair bouwjaar",
      "opmerkingen": ""
    },
    {
      "id": "dak",
      "type": "dak",
      "subtype": "Hellend dak",
      "begrenzing": "Buitenlucht",
      "orientatie": "horizontaal",
      "oppervlakte_m2": 60.0,
      "isolatie_aanwezig": "Niet",
      "rc_huidig": 0.86,
      "u_huidig": null,
      "spouw_aanwezig": null,
      "isolatiedikte_mm": null,
      "glastype": "",
      "kozijnmateriaal": "",
      "rc_bron": "Forfaitair bouwjaar",
      "opmerkingen": ""
    },
    {
      "id": "raam-z",
      "type": "kozijn",
      "subtype": "Raam",
      "begrenzing": "Buitenlucht",
      "orientatie": "Z",
      "oppervlakte_m2": 13.54,
      "isolatie_aanwezig": "Onbekend",
      "rc_huidig": null,
      "u_huidig": 2.9,
      "spouw_aanwezig": null,
      "isolatiedikte_mm": null,
      "glastype": "Dubbel",
      "kozijnmateriaal": "Hout",
      "rc_bron": "",
      "opmerkingen": ""
    }
  ],
  "ventilatie": {
    "systeem": "C: natuurlijke toevoer, mechanische afzuiging",
    "wtw_rendement_pct": null,
    "co2_sturing": null,
    "opmerkingen": "Mechanische box; natuurlijke toevoer via roosters."
  },
  "berekening": {
    "kwh_m2_huidig": 121.09,
    "standaard_eis_kwh_m2": 70.0,
    "kwh_m2_na_maatregelen": null,
    "label_huidig": "B",
    "bron": "Vabi EPA-W (NTA8800)"
  },
  "maatregelen": [
    {
      "code": "V1-1-A2",
      "onderdeel": "A Gevel",
      "omschrijving": "Spouwmuurisolatie vlokken (minerale wol) 60 mm van 45 m² tot 75 m²",
      "materiaal": "",
      "rc_u_doel": "Rc 6",
      "oppervlakte_m2": 48.0,
      "eenheid": "m²",
      "prijs_per_eenheid": 21.13,
      "kosten": 1014.24,
      "categorie": 1,
      "biobased": false
    },
    {
      "code": "V2-3-A6",
      "onderdeel": "B Glas en kozijnen",
      "omschrijving": "Vervangen glas door HR++ glas in bestaand houten kozijn: van 8 m² tot 15 m²",
      "materiaal": "",
      "rc_u_doel": "U 1,2",
      "oppervlakte_m2": 13.54,
      "eenheid": "m²",
      "prijs_per_eenheid": 253.23,
      "kosten": 3428.73,
      "categorie": 1,
      "biobased": false
    },
    {
      "code": "V3-1-B2",
      "onderdeel": "C Vloeren",
      "omschrijving": "Vloerisolatie isolatiefolie Rc vanaf 3.50 m².K/W  vanaf 35 m²",
      "materiaal": "",
      "rc_u_doel": "Rc 3,5",
      "oppervlakte_m2": 56.31,
      "eenheid": "m²",
      "prijs_per_eenheid": 53.88,
      "kosten": 3033.98,
      "categorie": 1,
      "biobased": false
    },
    {
      "code": "V4-1-C2",
      "onderdeel": "D Daken",
      "omschrijving": "Dakisolatie glaswol ingeblazen dik 130mm  Rc 3.50 m².K/W van 45 m² tot 120 m²",
      "materiaal": "",
      "rc_u_doel": "Rc 8",
      "oppervlakte_m2": 60.0,
      "eenheid": "m²",
      "prijs_per_eenheid": 64.1,
      "kosten": 3846.0,
      "categorie": 1,
      "biobased": false
    }
  ],
  "haalbaarheid": [
    {
      "maatregel_code": "V3-1",
      "asbest": false,
      "lood": null,
      "bereikbaarheid": "Goed",
      "kruipruimte_diepte_cm": 45,
      "obstakels": "",
      "vocht": false,
      "toelichting": "Kruipruimte toegankelijk en droog."
    }
  ],
  "fotos": [
    {
      "bestand": "huisnummer.jpg",
      "bouwdeel": "-",
      "type": "huisnummer"
    },
    {
      "bestand": "voorgevel.jpg",
      "bouwdeel": "-",
      "type": "voorblad"
    }
  ],
  "validatie": {
    "status": "onbekend",
    "issues": []
  },
  "meta": {
    "catalogus_versie": "V3_Q2_03062026",
    "gegenereerd_op": "2026-06-07",
    "tool_versie": "0.1"
  }
}